id,item_group_id,title,description,availability,condition,price,link,image_link,brand
ES_B0FXWKZXPY_7406dec6fc,ES_B0FXWKZXPY,(ES)🇪🇸西拔牙爆闪,"Keyword: repelente de animales por infrarrojos con diseño impermeable
Store: Daissz Store
remark: Need Text Review",in stock,new,0.00 EUR,https://amzn.to/48GvuDL,https://m.media-amazon.com/images/I/619Qjt8otbL._AC_SX679_.jpg,Daissz Store
ES_B0G6DS1TB2_56037873c2,ES_B0G6DS1TB2,(ES)🇪🇸西班牙驱鼠器,"Keyword: 4 piezas repelente ultrasónico de plagas
Store: Sichuan Jiabin Mounting Trading Co., Ltd.
remark: Need Text Review",in stock,new,0.00 EUR,https://amzn.to/4s9qTSM,https://m.media-amazon.com/images/I/71XibVKeZKL._AC_SL1500_.jpg,"Sichuan Jiabin Mounting Trading Co., Ltd."
ES_B0G6KF1F9V_5a4eaf767c,ES_B0G6KF1F9V,(ES)🇪🇸西班牙驱赶器,"Keyword: Ahuyentador de Gatos Exterior
Store: ZENGXJIE LTD
remark: Need Text Review",in stock,new,0.00 EUR,https://amzn.to/40IPMZA,https://m.media-amazon.com/images/I/71mKtZSv2pL._AC_SL1500_.jpg,ZENGXJIE LTD
