id,item_group_id,title,description,availability,condition,price,link,image_link,brand
IT_B0BB39FT8Q_648123cb4f,IT_B0BB39FT8Q,(IT)🇮🇹意大利帽子图评,"Keyword: berretto cotone donna
Store: osvyo
remark: Need Image Review",in stock,new,0.00 EUR,https://amzn.to/4uVLGvk,https://m.media-amazon.com/images/I/71f3mZFAuFL._AC_SX466_.jpg,osvyo
IT_B0FM7V7S5Z_cfa02ac082,IT_B0FM7V7S5Z,(IT)🇮🇹意大利驱鼠器,"Keyword: Ultrasuoni per Topi
Store: HarryPotter World
remark: Need Text Review",in stock,new,0.00 EUR,https://amzn.to/3Yd06rE,https://m.media-amazon.com/images/I/71Pm2H2b0wL._AC_SX679_.jpg,HarryPotter World
IT_B0GR566L61_dba966c5fb,IT_B0GR566L61,(IT)🇮🇹意大利门牌图评,"Keyword: numero civico esterno
Store: Lingy Store
remark: Need Image Review",in stock,new,0.00 EUR,https://amzn.to/3QOutnI,https://m.media-amazon.com/images/I/61NnqeBKsKL._AC_SL1500_.jpg,Lingy Store
